302,"8.5.E","Utilize a variety of primary and secondary sources to analyze multiple perspectives on the cultural changes in South Carolina and the U.S. Human Geography Students study Earth’s human geography beginning with the use of maps and other geographic representations, geospatial technologies, and spatial thinking to understand and communicate geographic information. Students will examine patterns and processes of how human characteristics and activities vary across Earth’s surface and how humans understand, use, and alter the surface of Earth. Conceptual in nature rather than place specific, this course is organized systematically around the topics of population and migration geography, economic geography, cultural geography, political geography, and urban geography. Students will also learn to employ spatial concepts and landscape analysis to examine human patterns and processes and their environmental consequences. Instruction should utilize geographic thinking skills and themes developed for grade nine. The progression of developmentally appropriate geographic thinking skills begins in kindergarten and builds with each year of social studies instruction with a specific geographic focus in grades three and seven. These skills are aligned with the Profile of the South Carolina Graduate of world-class knowledge, world-class skills, and life and career characteristics. Geographic literacy and skills help students to understand past and current Earth conditions and better plan for the future. "
303,"Standard 1","Demonstrate an understanding of the characteristics, distribution, and migration of human populations on Earth’s surface. "
304,"Understanding","Human populations and migration patterns vary across Earth’s surface and change through time. The interaction between human and environmental conditions helps to explain the characteristics, spatial distributions, and movements of human populations. "
305,"HG.1.1.HS","Identify and analyze the spatial distributions and patterns of human population using maps and geographic models and representations. This indicator was developed to encourage inquiry into population distribution at different scales. This indicator also promotes inquiry into how population data is analyzed, created, and presented. "
306,"HG.1.3.HS","Analyze historical population and migration maps and models through time to predict future trends and patterns. This indicator is designed to promote inquiry into changes in fertility and mortality as observed through study of the Demographic Transition Model as it applies to different countries and regions. The Migration Transition Model also provides a framework to explore historical migration patterns and predict future ones. "
307,"HG.1.4.HS","Analyze and evaluate population and migration issues and policies from the local to the global scale using geographic models and representations. This indicator is designed to promote inquiry into the issues stemming from both aging and declining populations and policies that attempt to control population growth and decline. This indicator also promotes inquiry into large-scale voluntary migration patterns, and exploration of the economic, environmental, political, and social, conditions that then may lead to policies governing migration and pathways to citizenship, including quotas and guest worker systems. "
308,"HG.1.5.HS","Evaluate the cultural, economic, environmental, and political impacts of human migration on human settlements in various regions. This indicator is designed to promote inquiry into a broad range of impacts, both positive and negative, that human migration has on places that generate migrants, as well as those that receive migrants. This indicator is also designed to promote inquiry into how these impacts result from different types of migration including internal, international, involuntary, and voluntary, as well as how these impacts vary from place to place and at different scales. "
309,"HG.1.6.AG","Gather evidence of human population and migration, construct a map to explain current or future development issues at different scales, and communicate findings. "
310,"Standard 2","Demonstrate an understanding of the conditions, interconnections, and levels of economic development across Earth’s surface. "
311,"Understanding","Varying degrees of economic development exist across Earth and help to define and differentiate regions of the world. Communication, economic, and transportation systems are spatially organized and global interdependence results through continuous change and increasing interconnections. "
312,"HG.2.1.PR","Identify regions of varying degrees of economic development, and Economic explain the factors that influence the location and spatial distribution Development of these regions at the local and global scales using maps and geographic models and representations. This indicator was designed to encourage inquiry into the spatial distribution and measurement of development levels across the Earth. "
313,"HG.2.2.HS","Compare and evaluate different measures of development, and analyze patterns and trends in various regions of economic development. This indicator was developed to encourage inquiry into how a state measures development by analyzing economic, social, and demographic factors. This indicator also promotes inquiry into development trends. Equally important is inquiry into gender disparities. "
314,"HG.2.3.HS","Identify and analyze the spatial distributions and patterns of primary, secondary, and tertiary sectors and activities of production and consumption using maps and geographic models and representations. This indicator was developed to encourage inquiry into how different economic activities operate, how labor force involvement in each sector can help indicate development levels, and how the three economic sectors and activities of production and consumption are distributed at various scales. This indicator also promotes inquiry into changing gender roles throughout all sectors of the economy. "
315,"HG.2.4.PR","Explain the conditions and connections that contribute to global interdependence of communications, economic, and transportation systems. This indicator was developed to encourage inquiry into the location- specific advantages in economics, communication, and transportation, and how these have changed over time. This indicator also promotes inquiry into the costs and barriers of economic development. "
316,"HG.2.5.ER","Analyze the distribution and patterns of energy production and consumption over time, and evaluate the impacts and sustainability of different energy sources at varying scales. This indicator was developed to encourage inquiry into the distribution of patterns that illustrate energy production and consumption by countries at different levels of development and over time. This indicator also promotes inquiry into how the development of alternative energy sources impact places of production and consumption over time. "
317,"HG.2.6.AG","Gather evidence of economic development, construct a map to explain current or future development issues at different scales, and communicate findings. "
318,"Standard 3","Demonstrate an understanding of the characteristics of culture and cultural patterns and processes across Earth’s surface. "
319,"Understanding","There are many regional variations of culture and cultural patterns and processes which lead to varying levels of cultural isolation and interaction. Ethnic, linguistic, and religious cultural characteristics create unique cultural landscapes across Earth’s surface. "
320,"HG.3.1.HS","Identify the characteristics of popular and folk culture, and explain the factors that influence the location and spatial distribution of these types of culture at the local and global scales using maps and geographic models and representations. This indicator was developed to encourage inquiry into how popular and folk cultures are characteristically different and how they vary from place to and from time to time. This indicator also promotes inquiry into how factors influence the location and spatial distribution of these types of cultures. "
321,"HG.3.2.HS","Identify and analyze the spatial distribution, patterns, and diffusion of ethnic, linguistic, and religious cultural characteristics using maps Cultural and other geographic representations. Patterns and Processes This indicator was developed to encourage inquiry into cultural characteristics and patterns in different regions and at different scales across the world. This indicator also promotes inquiry into the processes driving cultural diffusion and how it impacts places at different scales. "
322,"HG.3.3.PR","Analyze and explain the conditions and connections that create ethnic, linguistic, and religious patterns at varying scales. This indicator was developed to encourage inquiry into how cultural characteristics are determined by a broad range of factors and interactions specific to a place. "
323,"HG.3.4.HS","Investigate and evaluate the cultural conditions in different regions that play a role in cooperation and conflict over time. This indicator was developed to encourage inquiry into how increasing interdependence has brought different cultural groups greater contact with each other and the ways in which this contact shapes interactions. "
324,"HG.3.5.PR","Compare and contrast cultural landscapes in various regions, and analyze the human imprint on different landscapes. This indicator was developed to encourage inquiry into how popular and traditional culture shaped landscapes differently. This indicator also promotes inquiry into the ways in which cultural landscapes can be interpreted. "
325,"HG.3.6.AG","Gather evidence of cultural patterns and processes, construct a map to explain current or future development issues at different scales, and communicate findings. "
326,"Standard 4","Demonstrate an understanding of how cooperation and conflict among people influence the division and control of Earth’s surface. "
327,"Understanding","Earth is globally interdependent, yet locally controlled. Through forces of globalization and regional variations, Earth’s territorial divisions are capable of cooperation or conflict that result in continual change of the modern state system. "
328,"HG.4.2.PR","Explain the conditions and connections that contribute to the creation of boundaries and states, and analyze how Earth’s surface is organized on a contemporary political map. This indicator was developed to encourage inquiry into the different types of boundaries that exist between countries and how these boundaries are created and administered. This indicator also promotes inquiry into how the contemporary political map is organized and how it has changed over time. "
329,"HG.4.3.PR","Analyze and evaluate the conditions and connections that have contributed to the development of the modern state system and the rise of supranationalism in various regions. This indicator was developed to encourage inquiry into how the modern state (i.e., country) system developed. This indicator also encourages inquiry into how ideas of autonomy, sovereignty, and self-determination can affect geopolitical developments. "
330,"HG.4.4.PR","Analyze how states spatially organize governance systems, and explain the distribution and patterns of these political systems in various regions. This indicator was developed to encourage inquiry into the range of ways that countries spatially organize their governments. This indicator also encourage inquiry into how the United States has organized its federal system to provide for democratic representation. "
331,"HG.4.5.HS","Explain how forces of globalization and regional variations in resources can create opportunities for change, conflict, and cooperation for the control of Earth’s surface. This indicator was designed to encourage inquiry into how globalization and resource competition results in changes to the political map. This indicator also promotes inquiry into how globalization can create both cooperation and conflict. "
332,"HG.4.6.AG","Gather evidence on boundary issues at different scales, construct a map to explain changes in control over people, land, or resources, and communicate findings. "
333,"Standard 5","Demonstrate an understanding of the distribution, function, patterns, and processes of human settlement across Earth’s surface. "
334,"Understanding","Human settlements, both urban and rural, vary according to their distribution, function, and patterns. Human settlements and the processes of urban development result in continual change of the urban landscape. "
335,"HG.5.1.PR","Identify and explain the conditions and connections that influence Urban Land the characteristics, forms, and functions of cities and their spatial Use distribution. This indicator was designed to encourage inquiry into the location of cities, including a city’s site and its situation relative to other places. This indicator also prompts inquiry into geographic factors that define a city’s built characteristics and its functions, as well as its connections to other cities. "
336,"HG.5.2.PR","Analyze and compare the arrangement of land used in human settlements in different regions using maps, models, and representations. This indicator was designed to promote inquiry into how the spatial distribution of cities can be explored through geographic models and a broad range of visual representations. This indicator also promotes inquiry into how the internal structure of cities, such as its transportation systems and particular land uses, has changed over time. "
337,"HG.5.3.ER","Identify and evaluate how the conditions and connections of settlements in various regions can create economic, environmental, political, social, and sustainability challenges at various scales. This indicator was designed to promote inquiry into the challenges faced by settlements in both urban and rural areas such as employment opportunities, effective governance, and appropriate infrastructure. This indicator also promotes inquiry into sustainability challenges cities face related to energy use, resource availability, and waste/pollution. "
338,"HG.5.4.HS","Explain and analyze how distribution and patterns of urban size and hierarchy shapes the design, planning, and structure of other human settlements. This indicator was designed to promote inquiry into how city size relates to the opportunities, goods, and services available there, and how those same features impact similar offerings in cities larger and smaller. This indicator also promotes inquiry into the ways in which geographic models can be used to analyze the structure, design, and planning of settlements. "
339,"HG.5.5.PR","Analyze and evaluate the connections between rural and urban regions and their impact on globalization at different scales. This indicator was designed to promote inquiry into how core and periphery regions differ in urban population and how these differences create distinct land use and cultural patterns. This indicator was also designed to promote inquiry into the specific relationship between urban and rural areas concerning food production and consumption. "
340,"HG.5.6.AG","Gather evidence on human settlements, construct a map to explain processes, patterns and functions in various regions, and communicate findings. Modern World History Students will study the history of the Modern World in grade ten, beginning with the time period of 1300 to present. Students will begin by learning about the emergence of the Modern World from 1300–1500, global affairs and interactions (1450– 1815), the rise of the new governments and competition in the global community (1815–1918), the emergence of new world powers (1885–1950), and the world from World War II to present day (1933–present). Students will learn all Modern World History through the lens of inquiry in order to study the world that trade created, which led to the influence of interactions of various changes to culture, governments, ideas, innovation, people, religion, and revolution with an intent to create a citizen who has a global perspective. Instruction should utilize the historical thinking skills and themes developed for grade 10. The progression of the developmentally appropriate historical thinking skills begins in kindergarten and builds with each year of history instruction. These historical thinking skills are aligned with the Profile of the South Carolina Graduate of world-class knowledge, world-class skills, and life and career characteristics. The indicators of standard one represent the skills utilized by students in each grade level to further explore the content. These skills have been deconstructed to aid in the scaffolding of student thinking and are not to be taught in isolation. The Social Studies grade-level standards can be categorized into content- and discipline-specific themes. These themes allow for connections to be made between content when teaching chronologically, the ability to teach thematically rather than chronologically, and to support project- or problem-based learning. "
341,"Standard 1","Demonstrate an understanding of the emergence of the modern world during the period of 1300–1500. "
342,"Understanding","The emergence of the modern world was a result of exploration, the development of international trade networks, and regional economic, political, and social systems. These new ideas and understandings of the world led to innovation and change. "
343,"MWH.1.CO","Compare and contrast the major political, social, and belief systems and their spatial distribution in the early modern world. This indicator was developed to encourage inquiry into the mosaic of the modern world between 1300 and 1500 focusing on the foundational understanding of Buddhism, Christianity, Confucianism, Daoism, Hinduism, Islam, and Judaism as well as highlight the development of early kingdoms, empires, and nation states. "
344,"MWH.1.CE","Examine the causes and effects of the events surrounding the Emergence Renaissance on the rise of Europe. "
345,"MWH.1.P","Summarize the motivations of worldwide exploration and the influence of exploration on world civilizations. This indicator was developed to encourage inquiry into the interactions between the European countries, pre-Columbian societies, the world-wide enslavement of native peoples, as well as individual Asian societies focusing on trade, exploration, and the emergence of an imperial world. "
346,"MWH.1.CX","Contextualize the Indian Ocean as the center of global exchanges within the historically significant Eastern Hemisphere trade networks. This indicator was developed to encourage inquiry into how the emergence of the Indian Ocean trade route, the Silk Road, and the power shifts between different groups happened as a result of economies, politics, population, resources, and technology. "
347,"MWH.1.CC","Analyze continuities and changes within the rise and expansion of the Ottoman Empire and its implications on the world. This indicator was developed to encourage inquiry into the changes that are facilitated through shifts in economic systems, the strength of government, access to technology, and the strength of leaders in the Ottoman Empire. Further inquiry into the continuities and changes of the emergence, expansion, and significance of the Ottoman Empire, pre-Columbian societies, Asian societies, and Africa in the world during the period is also encouraged. "
348,"MWH.1.E","Utilize a variety of primary and secondary sources to analyze multiple perspectives of global exchanges. "
349,"Standard 2","Demonstrate an understanding of the effects of commerce, innovation and expansion on global affairs and interactions during the period of 1450–1815. "
350,"Understanding","Global events are characterized by interaction within and between societies. Types of economic factors, expansion, government, and innovation sought to define and differentiate regions of the world. "
351,"MWH.2.CO","Compare and contrast the philosophies and practices of absolutism to the philosophies and practices of constitutional democracies. This indicator was developed to encourage inquiry into political philosophies including monarchies, constitutional governments, Commerce, autocracies, and democracies, and their impact on global affairs Innovation, during the age of commerce, expansion, and innovation. "
352,"MWH.2.CE","Summarize how major world revolutions created new global affairs and interactions. This indicator was developed to encourage inquiry into the causes of the new American democratic political institutions of the 18th century and their subsequent impact on the various political revolutions and institutions throughout the western hemisphere during the 19th century. "
353,"MWH.2.P","Analyze significant developments resulting from colonists in the Western Hemisphere applying the principles of the Enlightenment in the creation of the new political institutions during the period 1765–1815. This indicator was developed to encourage inquiry into the European Enlightenment, and how the ideas of the Enlightenment led to the British, American, French, Haitian, and Latin American Revolutions. "
354,"MWH.2.CX","Contextualize the impact of the Scientific Revolution and Enlightenment in expanding global interactions in commerce and innovations. This indicator was developed to encourage inquiry into the revolutionary events, scientific and political innovators, and the philosophies surrounding the Scientific Revolution, the Enlightenment, and the Protestant Reformation in Europe. "
355,"MWH.2.CC","Examine the continuities and changes in the development of world trade networks and colonialism. This indicator was developed to encourage inquiry into Atlantic exploration, colonialism, trade networks among African kingdoms and the increasing interaction between Asian countries due to trade. "
356,"MWH.2.E","Utilize a variety of primary and secondary sources to analyze multiple perspectives on global interactions. "
357,"Standard 3","Demonstrate an understanding of how the development of nationalism and industrialization affected the rise of new governments and competition in the global economy from 1815–1918. "
358,"Understanding","The rise and spread of imperialism and nationalism affected the landscape of and interactions between international entities during the 19th century. Factors such as cultural change, industrialism, nationalism, and revolution led to a worldwide shift which ultimately resulted in world war. "
359,"MWH.3.CO","Compare the significant turning points in the development of nationalism and their implications on the world. This indicator was developed to encourage inquiry into imperialism, World War I and the development of nationalism on the world. "
360,"MWH.3.CE","Analyze industrialization as a catalyst for new immigration and migration patterns. This indicator was developed to encourage inquiry into the causes and effects of immigration and forced migration throughout the world. "
361,"MWH.3.P","Summarize the installation of new governments during the Meiji Restoration, Russian Revolution, and Chinese Revolution. This indicator is intended to encourage inquiry into revolution and the challenges faced by the Chinese, Russian, and Meiji following the adoption of new government systems. "
362,"MWH.3.CX","Contextualize industrialization within the various cultural and political changes occurring during the 19th century. This indicator was developed to encourage inquiry into how industrialization in Great Britain, the United States, and Germany between the Napoleonic Wars and World War I gave context for changes that occurred during the period. "
363,"MWH.3.CC","Analyze continuities and changes in the quality of life in Europe resulting from industrialization. This indicator was developed to encourage inquiry into the continuities and changes in the quality of life of various industrial countries, including changes caused by technology, the creation of new sports and leisure activities, and urbanization and work-life. "
364,"MWH.3.E","Utilize a variety of primary and secondary sources to analyze multiple perspectives related to the development of nationalism and industrialization. "
365,"Standard 4","Demonstrate an understanding of how international competition and conflict realigned global powers during the time period of 1885–1950. "
366,"Understanding","Emerging global power led to an era of worldwide competition, innovation, and struggle. A shift in economics, power, and technology World contributed to global warfare ushering in a landscape marked by political change. "
367,"MWH.4.CO","Explain the motives for and effects of European countries in the Age of Imperialism. This indicator was developed to encourage inquiry into the demand for natural resources in order to fuel industrialization, the rise of nationalism, and the increasing economic and political competition between countries. The indicator was also developed to promote inquiry into how countries competed for lands to imperialize in order to fulfill their economic needs. "
368,"MWH.4.CE","Analyze the significant causes of World War I and how the Treaty of Versailles attempted to resolve future global conflicts. This indicator is intended to encourage inquiry into the significant causes of World War I and the impacts of the Treaty of Versailles, including its failure to prevent future global conflicts. "
369,"MWH.4.P","Summarize the significant technological innovations that led to the realignment of global powers. This indicator is intended to encourage inquiry into how the development of industrialization and wartime technologies led to the realignment of global powers. "
