1,"Standard 1","Utilize the college and career skills of a historian to study continuity and change over time for one’s personal history and one’s community. "
2,"Understanding","The development of historical thinking skills begins in kindergarten by comparing individuals and examining the ways in which they change and/or remain the same over time. "
3,"K.H.1","Identify similarities and differences between oneself and others. This indicator was developed to encourage inquiry into students’ individual characteristics in relation to those of their classmates. "
4,"K.H.2","Examine ways in which individuals change or stay the same over time. This indicator was developed to encourage inquiry into the ways that people change or stay the same over various periods of time, including days, weeks, and the school year. "
5,"K.H.3","Identify different forms of evidence used in historical inquiry, such as digital sources, maps, photographs/images, or texts. This indicator was developed to encourage inquiry into what one can learn about the world by identifying and utilizing primary sources. "
6,"Standard 2","Utilize the college and career skills of a geographer to apply map skills and draw conclusions about place in one’s personal community. "
7,"Understanding","Map literacy skills are essential to the synthesizing of cultural and natural information which allows for geographic questioning within the social studies standards. "
8,"K.G.1","Identify a map, various map features, and explain the purpose of Geography maps. This indicator was developed to encourage inquiry into the purpose of maps and begin to recognize how the parts of maps are used to gain information (e.g., map title, map key/legend). This indicator was also developed to encourage the use of positional words used to describe locations on maps. "
9,"K.G.2","Utilize sources of geographic information (e.g., digital sources, maps, or photographs/images) to define and identify cultural and/or natural features. This indicator was developed to encourage inquiry into natural features, such as mountains, oceans, and rivers and cultural features, such as buildings, restaurants, roads, and stores. "
10,"K.G.3","Describe and compare the cultural and natural environment around one’s home and school by constructing a visual representation. This indicator was developed to encourage inquiry into how the cultural and natural features in the students’ community vary from one place to another, and to create a map or other representation to communicate those differences. "
11,"Standard 3","Utilize the college and career skills of an economist to understand how economic decisions affect one’s personal community. "
12,"Understanding","Fundamental economic concepts introduced in kindergarten are developed throughout social studies education and impact one’s everyday choices. "
13,"K.E.1","Identify and compare wants and needs. This indicator was developed to encourage inquiry into the differences between wants and needs and that different individuals have different wants and needs. "
14,"K.E.2","Explain how wants and needs change over time. This indicator was designed to encourage inquiry into how wants and needs change as individuals grow and change. "
15,"K.E.3","Explain why people have jobs, and describe the economic benefits for self and community. This indicator was developed to encourage inquiry into how jobs allow community members to have consumer choice and to meet individual needs. "
16,"K.E.4","Identify an economic want or need at one’s school or community level and create a solution. This indicator was developed to encourage inquiry into real world economic wants and needs and encourage hands-on practice to find possible solutions. "
17,"Standard 4","Utilize the college and career skills of a political scientist to understand and display civic dispositions in one’s personal community. "
18,"Understanding","Attributes of responsible citizenship requires individuals of diverse cultural backgrounds to employ dispositions to promote strong relationships. "
19,"K.CG.1","Identify similarities and differences between people and discuss ways to protect and respect all people by practicing civic dispositions. This indicator was developed to encourage inquiry into diversity within the classroom and community. Further, inquiry promotes identifying civic dispositions (e.g., compassion, cooperation, empathy, honesty, and respect) that are already exhibited in the classroom setting and can be used for problem solving in the future. "
20,"K.CG.2","Explain the purpose of rules and laws, and discuss consequences of breaking them. Civics & Government This indicator was developed to encourage inquiry into identifying rules and laws in the classroom, home, and the community and how these rules are necessary for safety. "
21,"K.CG.3","Establish and practice classroom rules and procedures for listening and responding appropriately to others. This indicator was developed to encourage inquiry into identifying civic dispositions (e.g., compassion, cooperation, empathy, honesty, and respect). Further, inquiry promotes the discussion of rules already in place, the creation of rules, and habits needed for civil discourse. "
22,"K.CG.4","Collaborate with others to identify a classroom or school issue and propose a resolution using civic dispositions. This indicator was developed to encourage inquiry into identifying real world classroom or school problems and practice a hands-on approach when finding solutions. This practice furthers inquiry through civic dispositions necessary when working with others. Grade 1 Life in South Carolina Students in the primary grades (kindergarten–second grade) are building the foundation of social studies skills and themes that will follow them through grade 12 to prepare them for college and career. "
23,"Standard 1","Utilize the college and career skills of a historian to study continuity and change over time in South Carolina. "
24,"Understanding","The similarities and differences within South Carolina, and the exploration of associated patterns between them, allow students to develop the foundational understanding that history involves continuities and changes in people from all backgrounds, and that patterns of history develop over time. "
25,"1.H.1","Identify similarities and differences between one’s community and other South Carolina communities over time. This indicator was developed to encourage inquiry into the defining characteristics of a students’ own community. Further, inquiry should include the finding of similarities and differences among communities throughout South Carolina to build comparison skills for historical inquiry. "
26,"1.H.2","Analyze a current event in South Carolina and make predictions about possible outcomes. This indicator was developed to encourage inquiry into the causes and effects of current events specific to South Carolina, such as a recent weather experience or a new law. This promotes further inquiry into how events have affected their own lives and community. "
27,"1.H.3","Evaluate different sources of evidence used in historical inquiry, such as art, artifacts, digital sources, graphs, maps, oral histories, photographs/images, and texts. This indicator was developed to encourage inquiry into evaluating and utilizing primary sources as sources of knowledge to learn about South Carolina. "
28,"Standard 2","Utilize the college and career skills of a geographer to apply map skills and draw conclusions about places in South Carolina and South Carolina’s place in the surrounding region. "
29,"Understanding","By studying South Carolina’s diverse physical geography and the state’s location relative to other places in the United States, students begin to develop an understanding that humans interact with the various features of Earth and consequently create different cultural, economic, and historical landscapes. "
30,"1.G.1","Identify various types of maps, map features, and the purpose of maps. This indicator was developed to encourage inquiry into a variety of maps (e.g., maps of malls, roads, schools, zoos, and the world) and the purpose of different types of maps. Further, inquiry is made into map features (e.g., map title, map key/legend, and compass rose) and how they are tools in geographic inquiry. "
31,"1.G.2","Identify and describe the geographic location of South Carolina in relation to the rest of the United States through the use of various maps and geographic tools. This indicator was developed to encourage inquiry into a variety of sources used to investigate and compare the location of South Carolina to the rest of the United States. "
32,"1.G.3","Identify and differentiate between rural, suburban, and urban areas within South Carolina. This indicator was developed to encourage inquiry into the characteristics of urban, rural, and suburban areas within South Carolina. "
33,"1.G.4","Describe and compare various landforms within South Carolina through the use of primary and secondary sources. This indicator was developed to encourage inquiry into a variety of sources used to investigate and compare different landforms (e.g., coastlines, lakes, mountains, and rivers) within South Carolina. "
34,"Standard 3","Utilize the college and career skills of an economist to understand how economic decisions affect South Carolinians. "
35,"Understanding","By exploring how the availability of resources influences economic conditions in South Carolina, students begin to understand how resources impact the personal economic decisions that individuals make. "
36,"1.E.1","Compare goods and services in the school, community, and state. This indicator was designed to encourage inquiry into the differences between goods and services. The indicator also encourages inquiry into the identification of goods as items for purchase (e.g. school lunch) and services as actions that benefit others. "
37,"1.E.2","Explain how goods and services change over time. This indicator was designed to encourage inquiry into the goods and services relevant to one’s own life, such as cell phones and computers, and how their relevance is affected by an individual’s changing wants and need. (This indicator was also designed to promote inquiry into the relationship wants and needs and their relationship to goods and services...) "
38,"1.E.3","Research and describe how goods and services differ in rural, suburban, and urban areas in South Carolina. This indicator was designed to encourage inquiry into how goods and services vary in different communities. This indicator was also designed to promote inquiry into the identification of the goods and services available in their community and compare these to other South Carolina communities, such as farming in rural communities and shipping in coastal communities. "
39,"1.E.4","Identify an economic want or need at the local or state level and create a solution in the form of a good or a service. This indicator was developed to encourage inquiry into how economic decisions influence everyday life. Inquiry is also encouraged through finding achievable ways to support one’s community, such as making posters to promote recycling. "
40,"Standard 4","Utilize the college and career skills of a political scientist to understand and display civic dispositions about contemporary South Carolina. "
41,"Understanding","Responsible citizenship requires individuals of diverse cultural backgrounds to employ dispositions that promote strong relationships. "
42,"1.CG.1","Demonstrate how civic dispositions encourage citizens with diverse Civics & beliefs and backgrounds to work together for a common goal. Government This indicator was developed to encourage inquiry into working with others with stories different from their own. This indicator was also developed to encourage inquiry into the identification of examples of this behavior that are already occurring and how to use civic dispositions to better accomplish a task. "
43,"1.CG.2","Describe the basic purpose, structure, and functions of South Carolina’s government at both the local and state level. This indicator was developed to encourage inquiry into the hierarchy of local and state government, how they work together, and the basic responsibilities they have for the people of South Carolina. "
44,"1.CG.3","Demonstrate ways to display active and responsible citizenship in local and state government. This indicator was designed to promote inquiry into how to be an active citizen. The indicator was also developed to encourage inquiry through examples of citizenship within one’s school, the community, and at the state level. "
45,"1.CG.4","Collaborate with others to identify, resolve, and communicate resolutions on a local or state issue. This indicator was designed to encourage inquiry into community and state issues. The indicator was also designed to promote inquiry into state issues by using one’s own experiences, connecting with other classrooms across the state, or viewing appropriate news sources. Grade 2 Life in the United States Students in the primary grades (kindergarten–second grade) are building the foundation of social studies skills and themes that will follow them through grade 12 to prepare them for college and career. "
46,"Standard 1","Utilize the college and career skills of a historian to study the continuity and changes over time in the United States. "
47,"Understanding","Students will employ the historical thinking skills of comparison, cause and effect, continuities and changes, and sourcing to study the diversity of the United States. "
48,"2.H.1","Identify and compare significant historical events, moments, and symbols in U.S. history. This indicator was developed to encourage inquiry into historical events, including figures, symbols, and observances, that have been important to the U.S. over time as well as how they impact us. "
49,"2.H.2","Examine current or past events from U.S. history, and discuss the possible causes and effects. This indicator was developed to encourage inquiry into multiple causes and effects of events in U.S. history. This indicator also promotes History inquiry into how to practice appropriate group discussion and civic dispositions, especially related to citizens’ roles in current events. "
50,"2.H.3","Analyze patterns of continuities and changes within U.S. history through the use of a variety of sources, including graphic organizers, maps, oral histories, photographs/images, texts, and timelines. This indicator was developed to promote inquiry into changes that occur over various periods of time and recognize patterns in history. The indicator was also developed to encourage the exposure to resources, such as charts, graphs, timelines, and tables. "
51,"2.H.4","Evaluate different forms of evidence used in historical inquiry and determine their validity. This indicator was developed to encourage inquiry into how to critically evaluate sources for validity. The indicator was also developed to promote inquiry into how to ensure data is accurate, citable, complete, credible, current, and objective. "
52,"Standard 2","Utilize the college and career skills of a geographer to apply map Geography skills and draw conclusions about the United States. "
53,"Understanding","The availability of resources and the physical features associated with them vary in different locations around the U. "
54,"2.G.1","Identify the geographic location of the U. "
55,"2.G.2","Describe and compare various landforms over time within the U.S. through the use of primary and secondary sources. This indicator was developed to encourage inquiry into using historic images, maps, narratives, texts, or video, to investigate and compare different landforms around the U.S. "
56,"2.G.3","Explain how the distribution of human features, physical features, and natural resources within the U. S changes over time and impacts economic activity. This indicator was developed to encourage inquiry into how rivers, lakes, mountains, and other land features affect economic activity. This indicator also prompts students to explore how different geographic areas support different activities in different times due the availability of resources. "
57,"Standard 3","Utilize the college and career skills of an economist to understand how economic decisions affect citizenship within the United States. "
58,"Understanding","Creating and utilizing budgets are a foundation to becoming financially literate. Students will analyze components of budgeting, including wants and needs, to develop foundational financial literacy skills. "
59,"2.E.1","Examine the purpose of currency and how income, savings, and Economics spending are parts of a budget. This indicator was developed to encourage inquiry into the purpose of currency and how currency is related to economic activity. The indicator was also designed to promote inquiry into decision-making concerning spending and saving money. "
60,"2.E.2","Explain how budgets change as wants and needs or the availability of goods and services change. This indicator was developed to encourage inquiry into economic decision making, specifically how choices are made based on both wants and needs and the availability of goods and services. "
61,"2.E.3","Create a simple budget, and articulate the priorities using economic terms such as expenses, income, and savings. This indicator was developed to encourage inquiry into different factors that must be considered when creating a budget. "
62,"2.E.4","Interpret data to show how geographic location and available resources impact economic decision-making. This indicator was developed to encourage inquiry into how location is related to resources and economics as resources change temporally in addition to vary spatially. "
63,"Standard 4","Responsible citizenship requires individuals of diverse cultural backgrounds to employ dispositions that promote strong relationships to develop solutions to communal problems. "
64,"Understanding","Students will develop the skills necessary to address shared problems in a respectful and productive manner. "
65,"2.CG.1","Identify cultural and ethnic groups in the U. "
66,"2.CG.2","Use primary and secondary sources to research a national figure who demonstrated civic dispositions. This indicator was developed to encourage inquiry into past and present national figures who demonstrated civic dispositions (i.e., compassion, cooperation, empathy, honesty, and respect) by exploring a variety of sources, such as children’s literature, historic documents, photographs and images, or news sources. "
67,"2.CG.3","Analyze how rights are granted to U. "
68,"2.CG.4","Use evidence to propose and communicate a resolution to a national issue. This indicator was developed to encourage inquiry into identifying and proposing solutions to problems at the national level. Grade 3 World Geography In grade three, students will explore the spatial distribution of Earth’s physical and human features and how these features interact to make Earth their home. Earth’s natural features and resources have both presented opportunities and constraints for how and where people have lived on Earth, in turn influencing the development of different cultural expressions. A geographic and skills-based study of the physical and human characteristics of places will bridge the skills practiced in the primary grades to the subsequent content and thinking skills of later grades. Instruction should utilize the specific geographic thinking skills and themes developed for grade three. The progression of the developmentally appropriate geographic thinking skills begins in kindergarten and builds with each year of geography instruction. These geographical thinking skills are aligned with the Profile of the South Carolina Graduate of world-class knowledge, world-class skills, and life and career characteristics. These skills have been deconstructed to aid in the scaffolding of student thinking and are not to be taught in isolation. The social studies grade-level standards can be categorized into content- and discipline-specific themes. These themes allow for connections to be made between content, the ability to teach thematically, and to support project or problem-based learning. "
69,"Standard 1","Use maps and globes to categorize places and regions by their human and physical conditions. "
70,"Understanding","Global citizenship begins with the initial understanding of Earth’s major features and how geographic information is used to learn about those features. "
71,"3.1.1.AG","Utilize an alphanumeric grid to locate the continents and oceans. This indicator prompts students to inquire about the location of major physical features around the world by utilizing a basic grid (i.e., letters on one axis, numbers on the other) as preparation for learning latitude and longitude. "
72,"3.1.2.AG","Locate the world’s four hemispheres (i.e., northern, southern, Map Skills and eastern, and western) by using the major components of Earth’s latitude and longitude (i.e., the Equator, the Prime Meridian, Features lines of latitude (i.e., parallels), lines of longitude (i.e., meridians), and the International Date Line). This indicator prompts students to inquire about how the world is divided for mapping purposes when using latitude and longitude. "
73,"3.1.3.PR","Identify the spatial hierarchy of political and physical geographic features. This indicator prompts students to inquire about spatial hierarchies (i.e., scale) to understand connections between Earth’s systems. Political features include cities, states, and countries. Physical features include forests, mountains, oceans, and rivers. "
74,"Standard 2","Demonstrate an understanding of Earth’s physical features and ecosystems that affect human activities. "
75,"Understanding","Earth’s diverse physical landscape provides the opportunity to discover how humans live and interact in various areas Environment and over time. Earth’s physical systems influenced human migration and People lifestyles and led to the creation of a diverse world. "
76,"3.2.1.ER","Recognize and explain how physical features are distributed around the world. This indicator prompts students to inquire about the distribution of landforms, climates, and biomes around the world. "
77,"3.2.2.ER","Identify and analyze the ways people interact with the physical environment in different regions of the state, the country, and the world. This indicator prompts students to inquire about a variety of geographic landforms, water bodies, and climate patterns around the world and how humans interact with them, including population distribution and settlement patterns. "
78,"3.2.3.ER","Identify spatial variations in climates around the world and recognize the relationship between climate and human activities. This indicator prompts students to inquire about how climate affects decision-making regarding such factors as food, clothing, and shelter around the world. "
79,"Standard 3","Demonstrate an understanding of the relationship between Earth’s environmental hazards and human activities. "
80,"Understanding","Earth’s physical environment can have profound effects on its inhabitants. Geographic information about physical systems can be used to create a related safety plan in the event of a natural disaster. "
81,"3.3.1.ER","Identify the range of natural hazards facing people and explain how some populations are more vulnerable than others. Environment and People This indicator prompts students to consider the various threats to humans including earthquakes, floods, hurricanes, tornadoes, volcanoes, and wildfires, and how human actions (e.g., building in a floodplain) can increase exposure and loss. "
82,"3.3.2.ER","Use maps and other sources of geographic information to gather evidence and draw conclusions about patterns of natural disasters around the world. This indicator prompts students to inquire about the geographic locations and patterns of natural disasters around the world by using maps and other sources of geographic information. Location and pattern connections may include how earthquakes occur along fault lines and hurricanes form over warm water near the Equator. "
83,"3.3.3.AG","Develop a natural disaster safety plan for a community. This indicator prompts students to inquire about natural disasters that typically occur in a community and then develop a practical plan to protect the community. "
84,"Standard 4","Demonstrate an understanding of varied human cultural and economic characteristics across Earth’s surface. "
85,"Understanding","The spatial distribution of Earth’s physical features and natural resources influences the development of various cultures and livelihoods. "
86,"3.4.1.PR","Investigate the cultural characteristics of places and regions around the world. This indicator prompts students to inquire about how geography influences cultural characteristics around the world. Culture may be expressed by architecture, arts and literature, clothing, cuisine, language, and religion, among other items. "
87,"3.4.2.HS","Investigate the economic and land use characteristics of Economy places and regions around the world. This indicator prompts students to inquire about how geography influences economic activities around the world. Economic livelihoods may be expressed by agriculture (subsistence, commercial), industry, and services. "
