237,"7.3.5.HS","Identify and analyze the current political boarders using maps, and explain resource relationships between Australia, Oceania, and Antarctica and other continents. This indicator was designed to encourage inquiry into the various ways that spaces have been divided and controlled within the Australia, Oceania, and Antarctic region by Continent Standards different culture groups throughout history. "
238,"7.3.6.AG","Gather evidence and construct a map or model to investigate a significant contemporary cultural, economic, or political issue facing Australia, Oceania, or Antarctica at the local, regional, or global scale. "
239,"Standard 4","Analyze the cultural, economic, environmental, physical, political, and population geographies of contemporary Europe. "
240,"Understanding","Europe is a geographically diverse continent with a variety of physical features and social structures. The physical and cultural regional conditions create unique European landscapes, an understanding of which lays the foundation for learning about the continent’s connection to the other peoples and places on Earth. "
241,"7.4.1.PR","Identify select European physical systems and human characteristics of places. This indicator was designed to encourage inquiry into the primary physical and human characteristics of places within the European continent, such as landforms, water bodies, countries, and cities. "
242,"7.4.2.ER","Identify climate and vegetation regions and the spatial distributions and patterns of natural resources, including the Europe impact of their location on human activities. This indicator was designed to encourage inquiry into the distribution and pattern of physical systems within the European continent and how the locations and characteristics of these systems influence livelihood choices available to people. "
243,"7.4.3.HS","Explain Europe’s current human population distributions and patterns, and use geographic models to compare the conditions driving migration and demographic change. This indicator was designed to encourage inquiry into the distribution and pattern of human populations within the European continent, why they are located where they are, and how those patterns change over time through economic, environmental, and politically driven migration. "
244,"7.4.4.HS","Compare and contrast the dynamic physical and human conditions that lead to the creation of ethnic, gender, language, Continent Standards and religious landscapes of European societies. This indicator was designed to encourage inquiry into the distribution and pattern of culture traits within the European continent, how they emerge, and how those patterns can change over time as they diffuse to other locations or contract and even disappear when confronted by other culture traits. "
245,"7.4.5.HS","Identify and analyze the current political borders using maps, and explain the connections between European countries based upon centripetal and centrifugal forces, as well as connections between European places and other continents. This indicator was designed to encourage inquiry into the various ways that spaces have been divided and controlled within the European continent by different culture groups throughout history. "
246,"7.4.6.AG","Gather evidence and construct a map or model to investigate a significant contemporary cultural, economic, or political issue facing Europe at the local, regional, or global scale. "
247,"Standard 5","Analyze the cultural, economic, environmental, physical, political, and population geographies of contemporary North America. "
248,"Understanding","North America is a geographically diverse continent with a variety of physical features and social structures. The physical and cultural regional conditions create unique North American landscapes, an understanding of which lays the foundation for learning about the continent’s connection to the other peoples and places on Earth. "
249,"7.5.1.PR","Identify select North American physical systems and human characteristics of places. North America This indicator was designed to encourage inquiry into the primary physical and human characteristics of places within the North American continent, such as landforms, water bodies, countries, and cities. "
250,"7.5.2.ER","Identify climate and vegetation regions and the spatial distributions and patterns of natural resources, including the impact of their location on human activities. This indicator was designed to encourage inquiry into the distribution and pattern of physical systems within the North American continent and how the locations and characteristics Continent Standards of these systems influence livelihood choices available to people. "
251,"7.5.3.HS","Explain North America’s current human population distributions and patterns, and use geographic models to compare the conditions driving migration and demographic change. This indicator was designed to encourage inquiry into the distribution and pattern of human populations within the North American continent, why they are located where they are, and how those patterns change over time through economic, environmental, and politically driven migration. "
252,"7.5.4.HS","Compare and contrast the dynamic physical and human conditions that lead to the creation of ethnic, gender, language, and religious landscapes of North American societies. This indicator was designed to encourage inquiry into the distribution and pattern of culture traits within the North American continent, how they emerge, and how those patterns can change over time as they diffuse to other locations or contract and even disappear when confronted by other culture traits. "
253,"7.5.5.HS","Identify and analyze the current political borders using maps, explain the economic, political, and social inequalities present in North American societies, and explain the connections between North American places and other continents. This indicator was designed to encourage inquiry into the various ways that spaces have been divided and controlled within the North American continent by different culture groups throughout history. "
254,"7.5.6.AG","Gather evidence and construct a map or model to investigate a significant contemporary cultural, economic, or political issue facing North America at the local, regional, or global scale. "
255,"Standard 6","Analyze the cultural, economic, environmental, physical, political, and population geographies of contemporary South America. "
256,"Understanding","South America is a geographical structure. The physical and cultural regional conditions create unique South American landscapes, an understanding of which lays the foundation for learning about the continent’s connection to the other peoples and places on Earth. "
257,"7.6.1.PR","Identify select South American physical systems (e.g., landforms and bodies of water), and human characteristics of places (e.g., countries and cities). This indicator was designed to encourage inquiry into the primary physical and human characteristics of places within the South American continent, such as landforms, water bodies, countries, and cities. "
258,"7.6.2.ER","Identify climate and vegetation regions and the spatial distributions and patterns of natural resources, including the impact of their location on human activities. This indicator was designed to encourage inquiry into the distribution and pattern of physical systems within the South American continent and how the locations and characteristics of these systems influence livelihood choices available to people. "
259,"7.6.3.HS","Explain South America’s current human population distributions and patterns, and use geographic models to compare the conditions driving migration and demographic change. This indicator was designed to encourage inquiry into the distribution and pattern of human populations within the South American continent, why they are located where they are, and how those patterns change over time through economic, environmental, and politically driven migration. "
260,"7.6.4.HS","Compare and contrast the dynamic physical and human conditions that lead to the creation of ethnic, gender, language, and religious landscapes of South American societies. This indicator was designed to encourage inquiry into the distribution and pattern of culture traits within the South American continent, how they emerge, and how those patterns can change over time as they diffuse to other locations or contract and even disappear when confronted by other culture traits. "
261,"7.6.5.HS","Identify and analyze the current political borders using maps, explain the economic, political, and social inequalities present Continent Standards in South American societies, and explain the connections between South American places and other continents This indicator was designed to encourage inquiry into the various ways that spaces have been divided and controlled within the South American continent by different culture groups throughout history. "
262,"7.6.6.AG","Gather evidence and construct a map or model to investigate a significant contemporary cultural, economic, or political issue facing South America at the local, regional, or global scale. Grade 8 South Carolina and the United States Students will study the history of South Carolina, within context of United States history in grade eight. This study begins with South Carolina’s colonial development and settlement as a British colony. South Carolinians played pivotal roles throughout the American Revolution and the Constitutional Convention, which established the foundations for the new nation. Sectional division came as a result of the growing institution of slavery, interpretations of the role of government, and expansion of the nation. South Carolina led the secession of Southern states, culminating in the Civil War. As the nation attempted to heal the wounds of the war, Reconstruction policies brought about political change while sectional division remained. The end of the 19th century ushered in industrialization to South Carolina and the nation, providing new opportunities for many people. Throughout the 20th century, South Carolina emerged as a national leader for defense production, agriculture, and tourism. As the state grew economically, social change was also brought on by the Civil Rights Movement. During the turn of the 21st century, South Carolina continues to attract businesses and people, while continuing to find solutions to new challenges. Instruction should utilize the historical thinking skills and themes developed for grade eight. The progression of developmentally appropriate historical thinking skills begins in kindergarten and builds with each year of history instruction. These historical thinking skills are aligned with the Profile of the South Carolina Graduate, with a focus on world-class knowledge, world-class skills, and life and career characteristics. The indicators of standard one represent the skills utilized by students in each grade level to further explore the content. These skills have been deconstructed to aid in the scaffolding of student thinking and are not to be taught in isolation. The Social Studies grade-level standards are categorized into content- and discipline-specific themes. These themes allow for connections to be made between content when teaching chronologically, the ability to teach thematically rather than chronologically, and to support project- or problem-based learning. These themes also allow students the opportunity to create change by engaging in civic participation. "
263,"Standard 1","Demonstrate an understanding of the development of South Carolina during the settlement and colonization of North America in the period of 1500– 1756. "
264,"Understanding","The Carolina colony was composed of indigenous, immigrant, and enslaved populations. Various factors across North America and the Carolina colony facilitated the eventual emergence of an American national identity. "
265,"8.1.CO","Compare the three British North American colonial regions economically, politically, socially, and in regard to labor development. This indicator was developed to encourage inquiry into how the three British colonial regions developed in terms of their culture, economies, geography, and labor. The indicator was also developed to encourage inquiry into the unique story of the development of South Carolina. "
266,"8.1.CE","Analyze the factors that contributed to the development of South Settlement and Carolina’s economic system and the subsequent impacts on different Development populations within the colony. This indicator was designed to encourage inquiry into the geographic and human factors that contributed to the development of South Carolina’s economic system. This indicator was also written to encourage inquiry into South Carolina’s distinct social and economic system as influenced by British Barbados. "
267,"8.1.P","Summarize major events in the development of South Carolina which impacted the economic, political, and social structure of the colony. This indicator was designed to encourage inquiry into the development of South Carolina as a result of mercantilist policies, which ranged from the Navigation Acts to trade with Native Americans to the use of enslaved people as labor. This indicator was also designed to promote inquiry into agricultural development, using the rice-growing knowledge of enslaved West Africans. "
268,"8.1.CX","Contextualize the development of South Carolina’s political institutions during the colonization of British North America. This indicator was designed to encourage inquiry into the development of the political structure of the South Carolina colony from the development of Charles Towne under English control to the movement toward self-rule. "
269,"8.1.CC","Analyze the changes and continuities of the Native Americans’ experiences prior to and as a result of settlement and colonization. This indicator was developed to encourage inquiry into Native American civilizations and cultures prior to European contact and their interactions with Europeans during the period of settlement and colonization, including their efforts to preserve their cultures. "
270,"8.1.E","Utilize a variety of primary and secondary sources to examine multiple perspectives and influences of the economic, political, and social effects of South Carolina’s settlement and colonization on the development of various forms of government across the colonies. "
271,"Standard 2","Demonstrate an understanding of how South Carolinians and Americans created a revolutionary form of government during the period of 1757– 1815. "
272,"Understanding","Political and economic developments underscored how the colonists in British North America had become uniquely American, prompting the development of a new nation. Drawing on their experience under British rule, the founding generation created a government with shared powers between the state and federal institutions. "
273,"8.2.CO","Compare the motives and demographics of loyalists and patriots within South Carolina and the colonies. Revolution and Identity This indicator was developed to encourage inquiry into the economic, political, and social motivations of the patriots and the loyalists in the era of the American Revolution. "
274,"8.2.CE","Explain the economic, political, and social factors surrounding the American Revolution. This indicator was developed to encourage inquiry into how the colonies began to unify to create a distinctive American identity over the course of events of the American Revolution. "
275,"8.2.P","Analyze significant founding principles that led to the development of federalism in South Carolina and the United States. This indicator was designed to encourage inquiry into the development of the Constitution, Declaration of Independence, the Articles of Confederation, and representative democracy. "
276,"8.2.CX","Contextualize the roles of various groups of South Carolinians as the colonies moved toward becoming an independent nation. This indicator was developed to encourage inquiry into the motivations of colonists during the American Revolution and the progression of conflict and failed compromise that ultimately led to revolution. "
277,"8.2.CC","Analyze the continuities and changes of how different groups immigrated to and migrated within South Carolina. This indicator was developed to encourage inquiry into the immigration and migration patterns of different groups within South Carolina, including their economic, political, and social power to do so. This indicator also promotes inquiry into an exploration of such ideas as the expansion of slavery and hostilities with the native peoples. "
278,"8.2.E","Utilize a variety of primary and secondary sources to analyze multiple perspectives on the development of democracy in South Carolina and the United States. "
279,"Standard 3","Demonstrate an understanding of conflict and compromise in South Carolina, the Southern region, and the United States as a result of sectionalism between the period 1816–1865. "
280,"Understanding","As the nation expanded, regional differences were exacerbated creating sectionalism threatening South Carolina’s identity and American unity. South Carolina struggled to maintain its unique culture and economy throughout the Reconstruction Era. "
281,"8.3.CO","Compare the debates between South Carolina and the federal government regarding slavery, federalism, and the Constitution. This indicator was developed to encourage inquiry into the debates, heightened by Westward Expansion, over federal and state power concerning slavery, and the government’s role in protecting and securing natural rights. "
282,"8.3.CE","Examine consequences of the major Civil War military strategies. This indicator was designed to encourage inquiry into the Civil War focusing on the impacts of military strategies and major turning points on South Carolina and the U.S. "
283,"8.3.P","Analyze the Civil War Amendments (i.e., 13th, 14th, and 15th) as a turning point in the economic, political, and social structures of South Carolina. This indicator was developed to encourage inquiry into the changes that served as a catalyst for Reconstruction. The indicator was also designed to promote inquiry into how these actions affected the economic, political, and social conditions in the South. "
284,"8.3.CX","Evaluate the economic significance of agriculture on South Carolina, the U.S., and the world. This indicator was designed to encourage inquiry into the economic implications of the expansion of the rice and cotton industries. This indicator was also developed to promote inquiry into Westward Expansion, the mutually beneficial impact of cotton on Northern factories and Southern plantations, and the emerging national and international markets. "
285,"8.3.CC","Analyze debates and efforts to recognize the natural rights of marginalized groups during the period of expansion and sectionalism. This indicator was designed to encourage inquiry into the continuities and changes of the experiences of marginalized groups such as African Americans, Native Americans and women, as the U.S. expanded westward and grappled with the development of new states. "
286,"8.3.E","Utilize a variety of primary and secondary sources to analyze multiple perspectives on the effects of the Civil War within South Carolina and the United States. "
287,"Standard 4","Demonstrate an understanding of South Carolina’s role in and response to the dynamic economic, political, and social developments in the United States and around the world during the period 1862–1929. "
288,"Understanding","Beginning with Reconstruction, South Carolina searched for ways to revitalize its economy and determine the social and political status of its population. Later in the period, South Carolina both contributed to World War I and grappled with economic depression. "
289,"8.4.CO","Compare perspectives toward reform that emerged during the Progressive Era. This indicator was designed to encourage inquiry into how new state and federal Progressive legislation affected individuals and businesses in South Carolina and the U.S. The indicator was also designed to promote inquiry into the new perspectives that emerged regarding social and political change. "
290,"8.4.CE","Explain the causes and effects of World War I on South Carolina and the United States. This indicator was developed to encourage inquiry into the significant causes of World War I and the factors leading to U.S. involvement. This indicator was also developed to promote inquiry into the effects of the war, to include its impact on the homefront, migration patterns, and continued foreign policy debates. "
291,"8.4.P","Summarize the economic changes that emerged in South Carolina and the U.S. This indicator was designed to encourage inquiry into South Carolina’s changing agriculture, industry labor force, and political alignments. This indicator was also designed to promote inquiry into the relationship between South Carolina’s economy and global events, to include imperialism and World War I. "
292,"8.4.CX","Evaluate South Carolinians’ struggle to create an understanding of their post-Civil War position within the state, the country, and the world. This indicator was developed to encourage inquiry into how the former planter class, African Americans, women, and others adjusted to, gained, lost, and/or regained position and status during Reconstruction. This indicator was also written to foster inquiry into how South Carolina worked with a stronger federal government and expanding international markets. "
293,"8.4.CC","Analyze continuities and change in the African American experience in the period of Reconstruction and Jim Crow eras within South Carolina. This indicator was developed to encourage inquiry into the successes and failures of Reconstruction, beginning with the Port Royal Experiment, in South Carolina. This indicator was written to explore development of the Constitutions of 1868 and 1895 and to analyze the evolution of restrictions for African Americans from the Black Codes in 1866 through the Plessy decision in 1898. "
294,"8.4.E","Utilize a variety of primary and secondary sources to analyze multiple perspectives of the challenges and changes within South Carolina and the nation that allowed the U.S. to emerge as a global power during the time period 1862–1929. "
295,"Standard 5","Demonstrate an understanding of the impact of world events on South Carolina and the United States from 1929 to present. "
296,"Understanding","As a result of new perspectives on national security following World War I, South Carolina continues to benefit from and contribute to national and global communities. Additionally, civic participation and social change altered South Carolina’s social standing and political alignment. "
297,"8.5.CO","Compare South Carolina and U.S. wartime contributions and demobilization after World War II. This indicator was designed to promote inquiry into military and economic policies during World War II, to include the significance of military bases in South Carolina. This indicator was also developed to foster inquiry into postwar economic developments and demographic changes, to include the immigration of Jewish refugees following the Holocaust. "
298,"8.5.CE","Analyze the factors contributing to the shifts in the political party platforms between 1946–1972. This indicator was designed to foster inquiry into the changes in South Carolina’s political party platforms resulting from the Civil Rights Movement, from Elmore v. Rice to the national Democratic Party’s support of civil rights to Nixon’s Southern Strategy. This indicator also supports inquiry into the effect on South Carolina’s political party platforms resulting from the emergence of the national Republican Party’s positions on foreign policy, limited government, and free trade policies. "
299,"8.5.P","Analyze the transformation of South Carolina’s economy from the Great Depression to its current economic diversification. This indicator was designed to promote inquiry into the devastation of the Great Depression and the impact of the New Deal on a largely agricultural South Carolina. This indicator was also designed to foster inquiry into the economic diversification between World War II and the present, to include tourism, global trade and industry, and the maintenance of military bases. "
300,"8.5.CX","Analyze the correlation between the Modern Civil Rights Movement in South Carolina and the U.S. This indicator was designed to foster inquiry into the role of South Carolina in the Modern Civil Rights Movement, to include the influence of court cases such as Briggs v. Elliot and Flemming v. South Carolina Electric and Gas. This indicator was also developed to promote inquiry into the relationship between national leadership, protests, and events and South Carolina leadership, protests and events, such as the Friendship Nine and the Orangeburg Massacre. "
301,"8.5.CC","Analyze the continuities and changes in South Carolina’s identity resulting from the civic participation of different individuals and groups of South Carolinians. This indicator was developed to encourage inquiry into civic engagement, such as military service, public demonstrations, and political activism, to shape the identity of modern South Carolina. This indicator was also written to encourage inquiry into South Carolinians’ use of the court system and legislation to affect South Carolina’s post-World War II identity. "
